{
  "mib": "0.2",
  "kind": "MIBSameModelCalibrationReport",
  "report_version": "0.2.0",
  "generated_at": "2026-09-06T06:05:57.291763Z",
  "experiment": {
    "id": "MIB-v0.2-generated-engineering-smoke",
    "status": "engineering_stub_completed",
    "experiment_lock": {
      "kind": "MIBSameModelExperimentLock",
      "version": "0.1.0",
      "experiment_id": "MIB-v0.2-generated-engineering-smoke",
      "model": {
        "client": "deterministic_stub",
        "model_id": "mib-deterministic-stub/0.1",
        "endpoint": null,
        "command": null,
        "parameters": {
          "temperature": 0,
          "max_tokens": 512
        },
        "seed_policy": "paired_per_call",
        "seed_derivation": "agent_seed + semantic_probe_or_task_turn_key; condition label excluded",
        "seed_base": "mib-same-model-0.1",
        "api_key_env": null,
        "header_value_fingerprints": {},
        "stateless_contract": true
      },
      "system_prompt_sha256": "ed0eba4ec45ffcad20f8d8668d94c98630c64d71177959eda908560e1ce4773e",
      "reasoning_policy_sha256": "70d15a93c194c6452d8233588ac04c4aec3280fd454b792df4844e46e974a8d6",
      "scenario_schema_sha256": "35671d3909f01ba574671d39bbe0177df6420a86f06026c32093079519b3260b",
      "profile_sha256": "e3d65ff97e58de9a2989f7fec4e5d4753b70a66409db38c490b8e611c0542c6f",
      "scenario_pack_sha256": "4f53cda18c2baa0c0354bb5f9a3ecbe5ed12ab4d8e11ba873c2f11161202b945",
      "runner_source_sha256": "3408ef4ad560857d7558edefe1ee11ae3e75147f760982f81cc7239909f892b3",
      "condition_order_policy": "counterbalanced_latin_rotation_v1",
      "conditions": {
        "B0": {
          "memory_policy": "no_memory"
        },
        "B1": {
          "memory_policy": "full_visible_history"
        },
        "B2": {
          "memory_policy": "lexical_top_k",
          "top_k": 4
        },
        "B3": {
          "memory_policy": "structured_deterministic",
          "top_k": 10,
          "salient_k": 6
        }
      },
      "memory_runtime": {
        "memory_char_limits": {
          "B0": null,
          "B1": null,
          "B2": null,
          "B3": null
        },
        "parse_retries": 1,
        "observe_decisions": true,
        "maintenance_decisions": true,
        "additional_baselines": {
          "recent_window": 12,
          "oracle_reference": true
        }
      },
      "allowed_condition_differences": [
        "memory_policy",
        "memory_selection",
        "memory_context_content"
      ],
      "digest": "sha256:b8545abb7e59484b2d499935e73d7d43ec825f7ea30e1ac09fc7e421427aa193"
    },
    "execution_plan": {
      "template_count": 42,
      "instance_seeds": 1,
      "repetitions": 1,
      "minimum_condition_runs": 558,
      "full_baseline_condition_runs": 168,
      "additional_causal_ablation_runs": 306,
      "additional_diagnostic_runs": 84,
      "minimum_model_turns": 23325,
      "note": "minimum_model_turns covers core baseline/causal calls, including observation and maintenance decisions. Tool-loop continuations, tool-result decisions, retries, preflight and optional additional baselines add calls. This is a lower bound, not a cost quote."
    }
  },
  "model_identity": {
    "client": "deterministic_stub",
    "model_id": "mib-deterministic-stub/0.1",
    "empirical": false
  },
  "statelessness_preflight": {
    "passed": true,
    "first_a_digest": "sha256:bd8852318abae77279baed86e428230c2596cd08c349323aee90d5cbca625f73",
    "second_a_digest": "sha256:bd8852318abae77279baed86e428230c2596cd08c349323aee90d5cbca625f73",
    "comparison": "exact_text_under_deterministic_or_seeded_parameters"
  },
  "condition_order_audit": {
    "policy": "counterbalanced_latin_rotation_v1",
    "paired_units": 42,
    "position_counts": {
      "B0": [
        11,
        10,
        10,
        11
      ],
      "B1": [
        11,
        11,
        10,
        10
      ],
      "B2": [
        10,
        11,
        11,
        10
      ],
      "B3": [
        10,
        10,
        11,
        11
      ]
    },
    "max_position_count_difference": 1,
    "balanced": true,
    "schedule_digest": "sha256:6ced22070f9d86edb1cacefd26ccac387217829a9e15a9956de8d8dc46d18e3d"
  },
  "pairing_audit": {
    "valid": true,
    "paired_units": 42,
    "mismatch_count": 0,
    "mismatches": []
  },
  "fairness_audit": {
    "valid": true,
    "checks": {
      "single_model_identity": true,
      "single_model_client_configuration": true,
      "identical_system_prompt": true,
      "identical_reasoning_policy": true,
      "identical_tool_interface": true,
      "identical_decoding_parameters": true,
      "deterministic_or_seeded_decoding": true,
      "stateless_model_contract": true,
      "statelessness_preflight": true,
      "only_memory_policy_varies": true,
      "condition_label_not_model_visible": true,
      "counterbalanced_condition_order": true,
      "paired_agent_seed_and_future_probe": true,
      "b1_full_context_not_truncated": true,
      "no_model_transport_or_parse_errors": true
    },
    "evidence": {
      "observed_model_calls": 23325,
      "distinct_model_identities": 1,
      "distinct_system_prompts": 1,
      "distinct_reasoning_policies": 1,
      "distinct_decoding_fingerprints": 1,
      "memory_policy_ids": [
        "B0",
        "B1",
        "B2",
        "B3"
      ],
      "condition_label_visible_calls": 0,
      "transport_errors": 0,
      "parse_errors": 0,
      "verification": "computed from recorded model invocations"
    }
  },
  "telemetry": {
    "B0": {
      "model_calls": 2064,
      "model_errors": 0,
      "input_chars_total": 7105414,
      "output_chars_total": 90324,
      "usage_totals": {},
      "memory_selections": 2064,
      "memory_records_available_total": 0,
      "memory_records_selected_total": 0,
      "memory_chars_selected_total": 14448,
      "memory_truncations": 0,
      "transport_errors": 0,
      "parse_errors": 0,
      "model_identities": [
        "{\"client\": \"deterministic_stub\", \"empirical\": false, \"model_id\": \"mib-deterministic-stub/0.1\"}"
      ],
      "system_prompt_shas": [
        "ed0eba4ec45ffcad20f8d8668d94c98630c64d71177959eda908560e1ce4773e"
      ],
      "reasoning_policy_shas": [
        "70d15a93c194c6452d8233588ac04c4aec3280fd454b792df4844e46e974a8d6"
      ],
      "decoding_fingerprints": [
        "b477d1f89909d8d156b5f1a61d7deea1ed47bec0cae59f106b6af8d8df242076"
      ],
      "memory_policy_ids": [
        "B0"
      ],
      "condition_label_visible_calls": 0
    },
    "B1": {
      "model_calls": 2064,
      "model_errors": 0,
      "input_chars_total": 19300629,
      "output_chars_total": 90318,
      "usage_totals": {},
      "memory_selections": 2064,
      "memory_records_available_total": 90518,
      "memory_records_selected_total": 90518,
      "memory_chars_selected_total": 12209663,
      "memory_truncations": 0,
      "transport_errors": 0,
      "parse_errors": 0,
      "model_identities": [
        "{\"client\": \"deterministic_stub\", \"empirical\": false, \"model_id\": \"mib-deterministic-stub/0.1\"}"
      ],
      "system_prompt_shas": [
        "ed0eba4ec45ffcad20f8d8668d94c98630c64d71177959eda908560e1ce4773e"
      ],
      "reasoning_policy_shas": [
        "70d15a93c194c6452d8233588ac04c4aec3280fd454b792df4844e46e974a8d6"
      ],
      "decoding_fingerprints": [
        "b477d1f89909d8d156b5f1a61d7deea1ed47bec0cae59f106b6af8d8df242076"
      ],
      "memory_policy_ids": [
        "B1"
      ],
      "condition_label_visible_calls": 0
    },
    "B2": {
      "model_calls": 2064,
      "model_errors": 0,
      "input_chars_total": 8169767,
      "output_chars_total": 90330,
      "usage_totals": {},
      "memory_selections": 2064,
      "memory_records_available_total": 90518,
      "memory_records_selected_total": 7992,
      "memory_chars_selected_total": 1078801,
      "memory_truncations": 0,
      "transport_errors": 0,
      "parse_errors": 0,
      "model_identities": [
        "{\"client\": \"deterministic_stub\", \"empirical\": false, \"model_id\": \"mib-deterministic-stub/0.1\"}"
      ],
      "system_prompt_shas": [
        "ed0eba4ec45ffcad20f8d8668d94c98630c64d71177959eda908560e1ce4773e"
      ],
      "reasoning_policy_shas": [
        "70d15a93c194c6452d8233588ac04c4aec3280fd454b792df4844e46e974a8d6"
      ],
      "decoding_fingerprints": [
        "b477d1f89909d8d156b5f1a61d7deea1ed47bec0cae59f106b6af8d8df242076"
      ],
      "memory_policy_ids": [
        "B2"
      ],
      "condition_label_visible_calls": 0
    },
    "B3": {
      "model_calls": 17133,
      "model_errors": 0,
      "input_chars_total": 82019909,
      "output_chars_total": 750614,
      "usage_totals": {},
      "memory_selections": 17133,
      "memory_records_available_total": 749348,
      "memory_records_selected_total": 165709,
      "memory_chars_selected_total": 23200995,
      "memory_truncations": 0,
      "transport_errors": 0,
      "parse_errors": 0,
      "model_identities": [
        "{\"client\": \"deterministic_stub\", \"empirical\": false, \"model_id\": \"mib-deterministic-stub/0.1\"}"
      ],
      "system_prompt_shas": [
        "ed0eba4ec45ffcad20f8d8668d94c98630c64d71177959eda908560e1ce4773e"
      ],
      "reasoning_policy_shas": [
        "70d15a93c194c6452d8233588ac04c4aec3280fd454b792df4844e46e974a8d6"
      ],
      "decoding_fingerprints": [
        "b477d1f89909d8d156b5f1a61d7deea1ed47bec0cae59f106b6af8d8df242076"
      ],
      "memory_policy_ids": [
        "B3"
      ],
      "condition_label_visible_calls": 0
    }
  },
  "additional_baselines": {
    "bounded_recent_context": {
      "templates": [
        {
          "template_id": "MIB-GEN-RECALL-V1-R0",
          "score": 0.0,
          "n": 1
        },
        {
          "template_id": "MIB-GEN-RECALL-V1-R1",
          "score": 0.0,
          "n": 1
        },
        {